{
  "$schema": "https://json-schema.org/draft/2020-12/schema",
  "$id": "https://github.com/Nuclominus/Agentic-SDLC-Pluguin/schemas/models.schema.json",
  "title": "SDLC Model Registry",
  "description": "Schema for plugins/sdlc/config/models/<host>.yaml — one registry per dispatcher (ADR-0029) — the machine-read single source of truth mapping a short `tag` (used in agent .md frontmatter `model: <tag>` and other local/plugin files) to the concrete provider `model_id`, and each model's `pricing` (USD per MTok, used for telemetry cost accounting). `pipeline_tiers` MIRRORS the is_valid_tier list in plugins/sdlc/hooks/enforce-agent-model.sh — keep them in sync. Entries outside `pipeline_tiers` are reference/pin-only: they exist so telemetry can price a model string the pipeline RECORDS but never dispatches by tag — including the models of a host this marketplace is emitted for (ADR-0029).",
  "type": "object",
  "required": [
    "models"
  ],
  "additionalProperties": false,
  "properties": {
    "$schema": {
      "type": "string"
    },
    "description": {
      "type": "string"
    },
    "provider": {
      "type": "string",
      "description": "Who sells these models (anthropic, google, openai). Documentation only — pricing is looked up by `model_id`, never by provider.",
      "pattern": "^[a-z][a-z0-9-]*$"
    },
    "pipeline_tiers": {
      "type": "array",
      "description": "Tags the pipeline dispatches and the enforcement hook validates. Every entry MUST also appear as a `tag` in `models`. ABSENT on a host where nothing is dispatched by tag — the emitter bakes the resolved model into each agent file at build time — and that absence is meaningful, not an omission.",
      "items": {
        "type": "string"
      },
      "minItems": 1,
      "uniqueItems": true
    },
    "cache_write_multipliers": {
      "type": "object",
      "description": "Prompt-cache CREATION price relative to a model's input rate (Anthropic standard, model-independent). The usage tool multiplies the per-turn ephemeral cache-creation token split by these before pricing at the input rate.",
      "additionalProperties": false,
      "properties": {
        "ephemeral_5m": {
          "type": "number",
          "minimum": 0,
          "description": "Multiplier for 5-minute-TTL cache writes (standard 1.25)."
        },
        "ephemeral_1h": {
          "type": "number",
          "minimum": 0,
          "description": "Multiplier for 1-hour-TTL cache writes (standard 2.0)."
        }
      }
    },
    "models": {
      "type": "array",
      "description": "Every available model, keyed by a unique `tag`.",
      "minItems": 1,
      "items": {
        "$ref": "#/$defs/model"
      }
    },
    "estimation_baselines": {
      "type": "object",
      "description": "Per-dispatch token baselines used ONLY by the Step 1d-1 dry-run cost preview. Never used for billing or the cost cap — those read transcript-derived actuals (ADR-0005/0011). Keys are pipeline tiers; underscore-prefixed keys are free-form provenance notes.",
      "additionalProperties": false,
      "patternProperties": {
        "^_": {
          "type": "string"
        }
      },
      "properties": {
        "opus": {
          "type": "object",
          "additionalProperties": false,
          "required": [
            "input",
            "cache_read",
            "cache_write",
            "output"
          ],
          "properties": {
            "input": {
              "type": "integer",
              "minimum": 0,
              "description": "Uncached input tokens for one dispatch. Small by design — nearly the whole prompt is served from cache after the first turn."
            },
            "cache_read": {
              "type": "integer",
              "minimum": 0,
              "description": "Prompt-cache READ tokens summed across the phase's turns. The dominant cost term: a phase re-reads its accumulated prefix every turn."
            },
            "cache_write": {
              "type": "integer",
              "minimum": 0,
              "description": "Prompt-cache CREATION tokens (priced at input rate x cache_write_multipliers.ephemeral_5m)."
            },
            "output": {
              "type": "integer",
              "minimum": 0,
              "description": "Output tokens for one dispatch."
            }
          }
        },
        "sonnet": {
          "type": "object",
          "additionalProperties": false,
          "required": [
            "input",
            "cache_read",
            "cache_write",
            "output"
          ],
          "properties": {
            "input": {
              "type": "integer",
              "minimum": 0,
              "description": "Uncached input tokens for one dispatch. Small by design — nearly the whole prompt is served from cache after the first turn."
            },
            "cache_read": {
              "type": "integer",
              "minimum": 0,
              "description": "Prompt-cache READ tokens summed across the phase's turns. The dominant cost term: a phase re-reads its accumulated prefix every turn."
            },
            "cache_write": {
              "type": "integer",
              "minimum": 0,
              "description": "Prompt-cache CREATION tokens (priced at input rate x cache_write_multipliers.ephemeral_5m)."
            },
            "output": {
              "type": "integer",
              "minimum": 0,
              "description": "Output tokens for one dispatch."
            }
          }
        },
        "haiku": {
          "type": "object",
          "additionalProperties": false,
          "required": [
            "input",
            "cache_read",
            "cache_write",
            "output"
          ],
          "properties": {
            "input": {
              "type": "integer",
              "minimum": 0,
              "description": "Uncached input tokens for one dispatch. Small by design — nearly the whole prompt is served from cache after the first turn."
            },
            "cache_read": {
              "type": "integer",
              "minimum": 0,
              "description": "Prompt-cache READ tokens summed across the phase's turns. The dominant cost term: a phase re-reads its accumulated prefix every turn."
            },
            "cache_write": {
              "type": "integer",
              "minimum": 0,
              "description": "Prompt-cache CREATION tokens (priced at input rate x cache_write_multipliers.ephemeral_5m)."
            },
            "output": {
              "type": "integer",
              "minimum": 0,
              "description": "Output tokens for one dispatch."
            }
          }
        },
        "fable": {
          "type": "object",
          "additionalProperties": false,
          "required": [
            "input",
            "cache_read",
            "cache_write",
            "output"
          ],
          "properties": {
            "input": {
              "type": "integer",
              "minimum": 0,
              "description": "Uncached input tokens for one dispatch. Small by design — nearly the whole prompt is served from cache after the first turn."
            },
            "cache_read": {
              "type": "integer",
              "minimum": 0,
              "description": "Prompt-cache READ tokens summed across the phase's turns. The dominant cost term: a phase re-reads its accumulated prefix every turn."
            },
            "cache_write": {
              "type": "integer",
              "minimum": 0,
              "description": "Prompt-cache CREATION tokens (priced at input rate x cache_write_multipliers.ephemeral_5m)."
            },
            "output": {
              "type": "integer",
              "minimum": 0,
              "description": "Output tokens for one dispatch."
            }
          }
        }
      }
    }
  },
  "$defs": {
    "model": {
      "type": "object",
      "required": [
        "tag",
        "model_id"
      ],
      "additionalProperties": false,
      "properties": {
        "tag": {
          "type": "string",
          "description": "Short alias used in local/plugin files (e.g. opus, sonnet, sonnet-4-6). Unique across the registry. Dots are allowed so a reference-only entry can use its provider's model string verbatim as its tag rather than inventing a second spelling of it.",
          "pattern": "^[a-z0-9][a-z0-9.-]*$"
        },
        "model_id": {
          "type": "string",
          "description": "The real provider model string used to invoke the model and for telemetry (e.g. claude-sonnet-5, gemini-3.1-pro-high). Provider-agnostic since Track J: a package emitted for another host records that host's model strings in its telemetry, and pricing is looked up by this exact string.",
          "pattern": "^[a-z][a-z0-9.-]*$"
        },
        "pricing": {
          "type": "object",
          "description": "USD per million tokens. Read by the pipeline for telemetry cost accounting. Optional per model — a model with no pricing yields cost_usd: null in telemetry (excluded from the total).",
          "additionalProperties": false,
          "properties": {
            "input": {
              "type": "number",
              "minimum": 0
            },
            "cached_input": {
              "type": "number",
              "minimum": 0
            },
            "output": {
              "type": "number",
              "minimum": 0
            },
            "note": {
              "type": "string",
              "description": "Optional annotation, e.g. a time-limited intro price and its expiry."
            }
          }
        }
      }
    }
  }
}
